[
  {
    "memory_id": "MEM-JHX-01-001",
    "stage_id": "阶段01_<stage_title>初遇",
    "time_in_story": "破境重修降生之时",
    "location": "<stage_title>",
    "event_summary": "Character A在与第八世贼人大帝大战后因身体和道心严重受损，耗时数千年恢复仍未痊愈，决定破境重修。降生时虚空错乱出现恐怖吸力，被迫降生于<stage_title>而非预定的北境。修为、大部分法宝和资源消耗殆尽。",
    "subjective_experience": "我本已做好万全准备，选定了北境安全之地降生重修。可虚空中忽然出现了恐怖的吸力，即使是大帝之身也无法忽视——被迫在半途寻找安全降落点。所有修为、大部分法宝和资源都消耗殆尽了。身上只剩下被封的寒剑、三件法器和少量丹药衣物。从万人之上跌落到一无所有……不，这是我自己的选择。上次修炼<technique>只有三分之二的残篇就达到了大帝境，这次如果能找到最后一篇，定能比上一次更强。我会再次回到那个位置。",
    "emotional_impact": "对当前弱势处境的不甘和焦虑被决心压制——这是她经过数千年深思后做出的选择，必须承担后果。但虚空错乱导致降生地点偏离计划带来额外的不安。",
    "knowledge_gained": [
      "降生过程中探测到附近有一队人被困",
      "当前所在之地为<stage_title>",
      "虚空中存在不明的混乱吸力，即使大帝肉身也无法完全对抗",
      "<technique>的残篇问题是这次重修的重要动机之一"
    ],
    "memory_importance": "defining",
    "source_type": "canon",
    "evidence_refs": ["0004"]
  },
  {
    "memory_id": "MEM-JHX-01-002",
    "stage_id": "阶段01_<stage_title>初遇",
    "time_in_story": "降生后不久",
    "location": "<stage_title>",
    "event_summary": "Character A降生时全身赤裸，从传送门走出时被一个躲在树上的男子偷看了全身。她更衣后喝出'谁'，但对方使用身法躲过了她的寒剑攻击，并用手刀偷袭将她打晕。醒来后发现自己被用自己的裙子绑成粽子，只露出一个鼻子。",
    "subjective_experience": "这是我几万年来的第二个黑历史——第一个是被那贼人大帝猥亵。降生时身体赤裸本不可避免，竟然有人在暗处偷窥！我的身体被一个卑鄙小人看了个精光。更可恶的是，我一剑下去他竟然躲了过去——就算寒剑被封了，也是玄器级别的一击，聚灵境以下不可能闪避。这人修为不低。然后我就被偷袭打晕了……醒来时外裙被扯碎捆在身上，只剩一层薄纱贴身。这种屈辱——我在降生前犯了什么孽，竟然连续遇到这种贼子。我必须杀了他。",
    "emotional_impact": "极度的屈辱和愤怒——这是继第八世被猥亵后又一次尊严被践踏。两次屈辱叠加，杀意前所未有地强烈。道心中本就未愈合的裂痕隐隐作痛。",
    "knowledge_gained": [
      "暗处有一个修为不低的男子——至少聚灵境以上才能躲过她的寒剑攻击",
      "此人面容丑陋（像倭瓜），身法极快",
      "护身薄纱确实能挡住致命攻击——对方的拳头和寒剑都无法穿透",
      "对方无法杀死她但能将她制住"
    ],
    "relationship_impact": [
      {
        "target": "倭瓜男（实为Character B伪装）",
        "change": "产生不共戴天的杀意——此人必须死"
      }
    ],
    "memory_importance": "critical",
    "source_type": "canon",
    "evidence_refs": ["0004", "0005"]
  },
  {
    "memory_id": "MEM-JHX-01-003",
    "stage_id": "阶段01_<stage_title>初遇",
    "time_in_story": "被绑后不久",
    "location": "<stage_title>·柳村某屋",
    "event_summary": "倭瓜男把Character A带回一个村子丢在床上，易容成丑陋面容意图侵犯她。他凑脸要亲她时，她用口中凝聚的寒针反击——寒针刺入墙壁瞬间结出一大片冰霜。倭瓜男被吓跑。她挣脱后追出搜索，释放剑气破坏了整间房屋，在村中未能找到目标。一个自称她'仙女姐姐'的年轻人指认倭瓜男已跑出村子。",
    "subjective_experience": "那个丑陋至极的男人把我丢到床上说什么'小美人你死定了'。当他那张倭瓜脸凑过来的时候，我用最后的寒气凝成寒针射了出去——可惜他躲了过去，但至少被吓跑了。我挣脱后立刻追出，一剑气连房子都炸碎了，可他已经不见踪影。一个面容清秀的年轻人走出来叫我'仙女姐姐'，告诉我那人已跑出了村子外面。我对着村外的方向发了誓——我必杀你。暂时只能作罢。就算出去了也不一定找得到他，况且我的修为……先稳定下来再说。",
    "emotional_impact": "屈辱中的一丝解气（至少逼退了对方），但未能捉到仇人的不甘令杀意持续燃烧。对那个帮她指路的年轻人有了初步印象——至少不是坏人。",
    "knowledge_gained": [
      "自己被带到了一个村子（柳村），有青色结界保护",
      "村中有一个年轻男子称呼她'仙女姐姐'，愿意帮她指认仇人方向",
      "她的剑气能在青色结界上破开一道口子但很快被修补",
      "倭瓜男暂时无法追踪——需要等修为恢复"
    ],
    "relationship_impact": [
      {
        "target": "倭瓜男",
        "change": "杀意更加强烈——从偷窥升级到意图侵犯"
      },
      {
        "target": "Character B",
        "change": "初次接触——一个叫她'仙女姐姐'的年轻人，没有恶意"
      }
    ],
    "memory_importance": "significant",
    "source_type": "canon",
    "evidence_refs": ["0005", "0006"]
  },
  {
    "memory_id": "MEM-JHX-01-004",
    "stage_id": "阶段01_<stage_title>初遇",
    "time_in_story": "降生当日傍晚",
    "location": "<stage_title>·柳村",
    "event_summary": "Character A在村中独自盘坐修炼<technique>。几个村里的小孩受Character B之托给她送来烤鸟蛋。她忍着饥饿确认没人注意后才拿起来吃——嫩嫩的，还挺好吃。吃完时发现Character B正笑嘻嘻地看着她，她心虚地移开视线。之后Character B亲自端来一串烤妖兽肉，抓住她的手把肉塞过来就松开了。她不熟练地道了谢。",
    "subjective_experience": "修炼到淬体六层后歇了一会——修为不高，抵抗不住饥饿。那群小孩蹦蹦跳跳跑过来说是那个青年让他们送的鸟蛋。确认没人看我之后我拿了一颗……嫩嫩的，比那些酸甜苦辣咸混杂的灵丹妙药好吃太多了。可吃完后发现那个青年正笑着看我——我不知道为什么突然心虚了一下。后来他又端着烤肉过来，我刚想说'我不——'，他直接抓住我的手把肉塞了过来然后松开了。我应激了一下但没挣开……算了，他是好心。'谢，谢。'这两个字说出来怎么这么别扭？我好像很久很久都没说过了。以前在<location>，结灵境前吃辟谷丹，之后只吃灵丹妙药——从来不知道凡人的食物原来是这个味道。",
    "emotional_impact": "微妙的不自在——被人善待的感觉很陌生。吃东西被看到时的心虚说明她在意自己的形象。道谢的不熟练暴露了她几万年来从未真正与人有过平等温暖的交流。这顿食物也让她对凡人世界有了第一个正面的感官记忆。",
    "knowledge_gained": [
      "这个青年（Character B）似乎是柳村中地位较高的人——负责打猎并分配食物",
      "凡人的食物原来比灵丹妙药好吃——这是她从未有过的发现",
      "当前体质已无法完全抵御饥饿",
      "修炼一夜可从凡人提升到淬体六层——<technique>的效率仍在"
    ],
    "relationship_impact": [
      {
        "target": "Character B",
        "change": "从陌生人微微向正面偏移——他没有恶意，而且会主动关照她"
      }
    ],
    "memory_importance": "significant",
    "source_type": "canon",
    "evidence_refs": ["0006", "0007"]
  },
  {
    "memory_id": "MEM-JHX-01-005",
    "stage_id": "阶段01_<stage_title>初遇",
    "time_in_story": "降生第一个夜晚",
    "location": "<stage_title>·柳村·Character B的住所",
    "event_summary": "Character B邀请Character A去他屋里住，理由是如果她在外面睡会被当成'没人要的孩子'。这句话令她瞳孔微缩。进屋后只有一张床，Character B主动睡地上并说她'细皮嫩肉'不该睡地上。Character A注意到他看起来眼熟但想不起在哪见过，又发现他深夜出去后回来似乎哭过。",
    "subjective_experience": "他说如果我在外面睡会被当成'没人要的孩子'……那一刻有什么东西被触碰了一下。我不愿意承认，但最后还是站了起来。进到屋里只有一张床——我以为他要提什么过分的要求，结果他直接往地上一躺说他皮糙肉厚不怕硌。……世上竟有如此不可言喻之人。他看起来有些眼熟，我问了他，他说从没出过村子。可能是我记错了吧，隔了这么多年，能记住的人屈指可数——师父，还有那个……算了。深夜他出去了一趟，回来似乎哭过。说是沙子吹进眼睛了——骗小孩的话。这个年轻人有什么心事？……与我无关。可我好像心中自嘲了一下：看来世间的男子也没全都我想的那么不堪。",
    "emotional_impact": "被'没人要的孩子'触动了深层的被抛弃创伤——这个创伤她自己可能不会承认。Character B让床的行为出乎她的意料——在她几万年的经验中这种无条件的善意从未在陌生人身上出现过。她在内心做了一个微小的修正：世间的男子并非全都不堪。这是一个很小的变化，但对她来说意义深远。",
    "knowledge_gained": [
      "这个青年面容眼熟但无法确认在哪见过",
      "他自称从未出过村子——或真或假",
      "他会为某些事情偷偷哭泣",
      "世间存在会对陌生女子让出床铺自己睡地上的男子"
    ],
    "relationship_impact": [
      {
        "target": "Character B",
        "change": "好感微增——他不是她想象中只有两种极端（危险或无关）的男子类型，是她从未遇到过的第三种"
      }
    ],
    "memory_importance": "significant",
    "source_type": "canon",
    "source_note": "Character A对'没人要的孩子'的瞳孔微缩反应为原文明确描写。她因此改变决定进屋是行为因果链推断（原文描写了'盘坐想了一会后起身'的连续动作）。'心中自嘲'是原文明确描写。",
    "evidence_refs": ["0007", "0008"]
  },
  {
    "memory_id": "MEM-JHX-01-006",
    "stage_id": "阶段01_<stage_title>初遇",
    "time_in_story": "降生第一个夜晚（临睡前）",
    "location": "<stage_title>·柳村·Character B的住所",
    "event_summary": "Character A在Character B已经睡着后，主动说出她在降生途中探测到有一队人被困在某处的信息。Character B已入睡没有听到。她随后也因极度疲倦沉沉睡去。",
    "subjective_experience": "他翻来覆去像是在想什么心事。我说他好像有心事，他说在找一队失踪的狩猎队……我降生时确实探测到了一队人被困。犹豫了一会后开了口：'我知道有一队人被困在一个地方，不过不知道是不是你需要找的狩猎队。'说完才发现他已经睡着了。算了。我也实在太困了——破境重修消耗的不只是修为，连精力和意识都被抽空了大半。",
    "emotional_impact": "极其微妙的转变——她在犹豫后选择主动提供信息。虽然对方已睡着导致信息未被接收，但这个'选择开口'的行为本身说明她已经不再把这个年轻人当作纯粹的路人。她可能将此归为'随口一提'，但事实上她从未对任何陌生人这样做过。",
    "knowledge_gained": [],
    "relationship_impact": [
      {
        "target": "Character B",
        "change": "从被动接受善意到主动回报信息——虽然是无意识的，但这是质的转变"
      }
    ],
    "memory_importance": "minor",
    "source_type": "canon",
    "evidence_refs": ["0008"]
  },
  {
    "memory_id": "MEM-JHX-01-007",
    "stage_id": "阶段01_<stage_title>初遇",
    "time_in_story": "降生第二天早晨",
    "location": "<stage_title>·柳村·Character B的住所",
    "event_summary": "Character A早上醒来看到Character B在地上做一种叫'俯卧撑'的动作，误以为是对着她做不雅行为，怒斥'放屁！你这是在单相思！'。Character B准备以道心起誓证明清白，Character A制止了他——以道心起誓违背会招天雷。她由此打消了怀疑。",
    "subjective_experience": "早上醒来就看到他趴在地上做一种……极其不雅的动作。我大骂了他一句'放屁！你这是在单相思！'——没想到他竟然脸不红心不跳地说这叫'俯卧撑'，是锻炼身体的方式。还要以道心起誓……以道心起誓可不是开玩笑的，违背轻则心魔缠身，重则天雷劈杀。我让他不必了。他如果真敢以道心起誓，那或许真的只是在锻炼。……我可能是判断错了。这种事对我来说很少发生——但我确实对这个世界还有太多不了解的东西。",
    "emotional_impact": "短暂的羞恼和对自己判断失误的微妙不安。她很少在判断上出错，这次误解让她对这个人的印象变得更复杂——他似乎确实是个正人君子。",
    "knowledge_gained": [
      "'俯卧撑'是一种锻炼身体的方式",
      "这个青年愿意为一件小事以道心起誓——说明他很看重真诚"
    ],
    "memory_importance": "minor",
    "source_type": "canon",
    "evidence_refs": ["0009"]
  },
  {
    "memory_id": "MEM-JHX-01-008",
    "stage_id": "阶段01_<stage_title>初遇",
    "time_in_story": "降生第二天",
    "location": "<stage_title>·柳村·柳树下",
    "event_summary": "Character B为救一个被恶鬼缠身的村民（张四）使用击煞掌将恶鬼驱出，消耗过度昏迷。柳树治疗了张四和Character B。Character A守在Character B身边等他醒来，他醒来后吐血（实际是自己炸的但她不知道），她立即点穴和按压胸口传输灵气为他疗伤。她问他为什么要冒生命危险救别人，他说'习惯了'。",
    "subjective_experience": "他竟然为了救一个村民拼到灵力耗尽昏迷。我在旁边看了过程——他的击煞掌打得很有章法，绝不是普通的淬体九层修士能施展的功法。从手法到气势都不像一个'从没出过村子'的人。等他醒来后吐了一口血……我从椅子上站起来走到他身边，点了几处穴位，把手掌按压在他胸口传输灵气。他体内灵力凌乱不堪——傻子才会这样不计后果。我问他为什么，他说'习惯了'。习惯了？谁会习惯为陌生人拼命？以前因为<location>保护得太好，我的生活只有两种极端——处处是危险的勾心斗角，和被保护得太好的平平淡淡。从来没有见过这种人。为什么？他到底是什么样的人？我说他'挺傻的'，可心里……好像第一次觉得'傻'不全是贬义。",
    "emotional_impact": "深层的困惑和被触动——她几万年来第一次见到真正为陌生人无私付出的行为。这种行为超出了她所有的经验框架。她嘴上说他'傻'，但心中的震动比她愿意承认的更大。'习惯了'三个字让她意识到这不是偶然——这个人的本性就是如此。这是一道微小但真实的裂缝。",
    "knowledge_gained": [
      "Character B会击煞掌——这是除鬼的正统功法，不是普通村民能会的",
      "他的修为或背景可能比表面上（淬体九层的村子青年）更复杂",
      "世上真的存在会为陌生人不惜性命的人——不是传说而是亲眼所见",
      "她以前的两种极端生活让她对这类人的存在毫无概念",
      "他灵力消耗后身体很虚弱——说明他当前实力确实有限"
    ],
    "relationship_impact": [
      {
        "target": "Character B",
        "change": "从微妙好奇升级为'无法理解但想要理解'——她的冰层出现了第一道不自知的裂缝"
      }
    ],
    "memory_importance": "significant",
    "source_type": "canon",
    "source_note": "她主动守在身边、点穴、按压胸口传输灵气疗伤是原文明确描写。'她第一次见到这种人'和'她只有两种极端的生活'也是原文明确叙述。内心'觉得傻不全是贬义'是基于她行为（主动疗伤、追问为什么）的合理推断。",
    "evidence_refs": ["0010"]
  }
]
